[
  {
    "id": "eu-ai-act",
    "title": "EU Artificial Intelligence Act",
    "short": "Regulation (EU) 2024/1689",
    "jurisdiction": "European Union",
    "region": "Europe",
    "level": "regional",
    "category": "hard_law",
    "kind": "Regulation",
    "binding": "binding",
    "status": "in_force",
    "status_note": "Entered into force 1 Aug 2024 and applies in phases: prohibitions from 2 Feb 2025, general-purpose AI obligations from 2 Aug 2025, most remaining obligations from 2 Aug 2026, some product-embedded high-risk rules from 2 Aug 2027. Check the status of proposed 'Digital Omnibus' amendments that would adjust timelines.",
    "year": 2024,
    "domain": "civil",
    "sections": [
      "civilian",
      "national"
    ],
    "approach": "Risk-based horizontal framework: strict and rights-focused",
    "sectors": [
      "cross-sector",
      "biometrics",
      "employment",
      "critical infrastructure"
    ],
    "summary": "The first comprehensive horizontal AI law. It sorts AI systems by risk and attaches obligations to each tier, with separate rules for general-purpose AI models.",
    "key_points": [
      "Four risk tiers: unacceptable (banned), high, limited (transparency) and minimal",
      "Extra duties for general-purpose AI models, including those posing systemic risk",
      "Excludes AI used exclusively for military, defence or national security purposes",
      "Fines of up to EUR 35 million or 7% of worldwide turnover for prohibited practices"
    ],
    "related": [
      "eu-gpai-code",
      "coe-convention",
      "iso-42001"
    ],
    "url": "https://eur-lex.europa.eu/eli/reg/2024/1689/oj",
    "verify": true,
    "last_verified": null
  },
  {
    "id": "eu-gpai-code",
    "title": "EU General-Purpose AI Code of Practice",
    "short": "Voluntary compliance tool under the AI Act",
    "jurisdiction": "European Union",
    "region": "Europe",
    "level": "regional",
    "category": "soft_law",
    "kind": "Code of practice",
    "binding": "non_binding",
    "status": "adopted",
    "status_note": "Published July 2025. Signing is voluntary, but it is designed to help providers show compliance with the AI Act's general-purpose AI obligations.",
    "year": 2025,
    "domain": "civil",
    "sections": [
      "civilian"
    ],
    "sectors": [
      "cross-sector"
    ],
    "summary": "A code drafted with industry and experts that explains how providers of general-purpose AI models can meet their AI Act duties on transparency, copyright and safety and security.",
    "key_points": [
      "Three chapters: transparency, copyright, and safety and security",
      "Safety and security chapter targets models with systemic risk",
      "Voluntary, but signatories may benefit from a presumption of good practice"
    ],
    "related": [
      "eu-ai-act"
    ],
    "url": "https://digital-strategy.ec.europa.eu/en/policies/ai-code-practice",
    "verify": true,
    "last_verified": "2026-09-25"
  },
  {
    "id": "coe-convention",
    "title": "Council of Europe Framework Convention on AI",
    "short": "CETS No. 225: human rights, democracy and the rule of law",
    "jurisdiction": "Council of Europe (open to non-members)",
    "region": "Global",
    "level": "international",
    "category": "hard_law",
    "kind": "Treaty",
    "binding": "pending",
    "status": "adopted",
    "status_note": "Opened for signature 5 Sep 2024. The EU ratified on 15 May 2026, per a Council of Europe announcement. Entry into force needs five ratifications, including at least three Council of Europe member states, so confirm the current ratification count in the treaty office table. The reference note lists 16 signatories, but signature alone does not bind a state.",
    "year": 2024,
    "domain": "civil",
    "sections": [
      "civilian"
    ],
    "sectors": [
      "cross-sector",
      "public sector"
    ],
    "summary": "The first legally binding international treaty on AI. It requires parties to manage AI risks to human rights, democracy and the rule of law across the system lifecycle.",
    "key_points": [
      "Covers public authorities and private actors acting on their behalf",
      "Parties choose how to address private-sector AI, through measures suited to their legal system",
      "National defence matters are excluded, and national security activities must still respect international law",
      "Open to signature by non-European states"
    ],
    "related": [
      "eu-ai-act",
      "oecd-principles"
    ],
    "url": "https://www.coe.int/en/web/artificial-intelligence/the-framework-convention-on-artificial-intelligence",
    "verify": true,
    "last_verified": null
  },
  {
    "id": "china-genai-measures",
    "title": "China: Interim Measures for Generative AI Services",
    "short": "Cyberspace Administration of China and other agencies",
    "jurisdiction": "China",
    "region": "Asia-Pacific",
    "level": "national",
    "category": "hard_law",
    "kind": "Administrative measures",
    "binding": "binding",
    "status": "in_force",
    "status_note": "In effect since 15 Aug 2023.",
    "year": 2023,
    "domain": "civil",
    "sections": [
      "civilian",
      "national"
    ],
    "approach": "Targeted and sector-specific: state oversight and content control",
    "sectors": [
      "content",
      "cross-sector"
    ],
    "summary": "Rules for providers offering generative AI services to the public in China, covering training data, content, and security assessment and filing requirements.",
    "key_points": [
      "Providers must use lawful data sources and respect intellectual property",
      "Generated content must adhere to Chinese content rules and core socialist values",
      "Services with public-opinion or social-mobilisation capacity face security assessment and algorithm filing"
    ],
    "related": [
      "china-labeling-measures"
    ],
    "url": "https://www.chinalawtranslate.com/en/generative-ai-interim/",
    "verify": false,
    "last_verified": null
  },
  {
    "id": "china-labeling-measures",
    "title": "China: Measures for Labeling AI-Generated Content",
    "short": "Explicit and implicit labels for synthetic content",
    "jurisdiction": "China",
    "region": "Asia-Pacific",
    "level": "national",
    "category": "hard_law",
    "kind": "Administrative measures",
    "binding": "binding",
    "status": "in_force",
    "status_note": "In effect since 1 Sep 2025, alongside a mandatory national standard on labeling methods.",
    "year": 2025,
    "domain": "civil",
    "sections": [
      "national"
    ],
    "approach": "Targeted: labeling and provenance of synthetic content",
    "sectors": [
      "content",
      "platforms"
    ],
    "summary": "Requires AI-generated text, images, audio and video to carry visible labels and embedded metadata, with duties on service providers and distribution platforms.",
    "key_points": [
      "Explicit labels visible to users, plus implicit labels in file metadata",
      "Platforms must check for and flag suspected AI-generated content"
    ],
    "related": [
      "china-genai-measures"
    ],
    "url": "https://www.hsfkramer.com/notes/tmt/2025-posts/China-Releases-Laws-to-Mandate-Labelling-of-AIGC",
    "verify": false,
    "last_verified": null
  },
  {
    "id": "us-eo-14179",
    "title": "US Executive Order 14179",
    "short": "Removing Barriers to American Leadership in AI",
    "jurisdiction": "United States (federal)",
    "region": "Americas",
    "level": "national",
    "category": "hard_law",
    "kind": "Executive order",
    "binding": "binding",
    "status": "in_force",
    "status_note": "Signed 23 Jan 2025. Binding on federal agencies, not directly on private parties. It revoked Executive Order 14110 of Oct 2023.",
    "year": 2025,
    "domain": "both",
    "sections": [
      "national"
    ],
    "approach": "Decentralised patchwork: federal guidance",
    "sectors": [
      "federal government",
      "cross-sector"
    ],
    "summary": "Sets a deregulatory federal direction on AI and orders an action plan to sustain US AI leadership, replacing the safety-focused approach of the previous order.",
    "key_points": [
      "Revoked Executive Order 14110 on safe, secure and trustworthy AI",
      "Directed development of a national AI action plan"
    ],
    "related": [
      "us-ai-action-plan"
    ],
    "url": "https://www.govinfo.gov/link/cpd/executiveorder/14179",
    "verify": true,
    "last_verified": "2026-09-25"
  },
  {
    "id": "us-ai-action-plan",
    "title": "America's AI Action Plan",
    "short": "US federal AI policy roadmap",
    "jurisdiction": "United States (federal)",
    "region": "Americas",
    "level": "national",
    "category": "soft_law",
    "kind": "Policy plan",
    "binding": "non_binding",
    "status": "adopted",
    "status_note": "Released July 2025 as a policy roadmap. It directs agency action but is not itself a statute.",
    "year": 2025,
    "domain": "both",
    "sections": [
      "national"
    ],
    "approach": "Federal policy roadmap",
    "sectors": [
      "federal government",
      "infrastructure",
      "defence"
    ],
    "summary": "A federal plan built around accelerating innovation, building AI infrastructure and leading in international AI diplomacy and security.",
    "key_points": [
      "Three pillars: innovation, infrastructure, international diplomacy and security",
      "Includes measures on federal and defence adoption of AI"
    ],
    "related": [
      "us-eo-14179"
    ],
    "url": "https://www.whitehouse.gov/wp-content/uploads/2025/07/Americas-AI-Action-Plan.pdf",
    "verify": true,
    "last_verified": "2026-09-25"
  },
  {
    "id": "us-colorado-ai-act",
    "title": "Colorado AI Act (SB 24-205)",
    "short": "Consumer protections for high-risk AI systems",
    "jurisdiction": "Colorado, United States",
    "region": "Americas",
    "level": "subnational",